{
  "id": 1438,
  "name": "PSPSokoban",
  "author": "Nino",
  "category": "game",
  "platform": "psp",
  "icon": "1438-pspsokoban.png",
  "description": "Sokoban for PSP.",
  "requirements": "",
  "direct_url": "https://archive.org/download/pspsokoban-1.0.7z/pspsokoban-1.0.zip",
  "version": "1.0",
  "screenshots": [],
  "trophies": false,
  "ai": false
}
