{
  "id": 1921,
  "name": "Tour of Light",
  "author": "ChaCheeChoo",
  "category": "game",
  "platform": "psp",
  "icon": "1921-tour-of-light.png",
  "description": "Futuristic racing game for PSP.",
  "requirements": "",
  "direct_url": "https://archive.org/download/to-lmulti-track.-7z/Old%20Versions/ToLAlpha011.zip",
  "version": "1.0",
  "screenshots": [],
  "trophies": false,
  "ai": false
}
