{
  "id": 1863,
  "name": "A Maze Planet",
  "author": "Vulcore Team",
  "category": "game",
  "platform": "vita",
  "titleid": "AMP000001",
  "direct_url": "https://github.com/DrDecki/VitaDBtoo-db/releases/download/mirror/1134-maze_planet.vpk",
  "version": "v.1.0",
  "prerelease": false,
  "icon": "1863-a-maze-planet.png",
  "description": "A Maze Planet is a procedurally generated dungeon crawler video game. You must explore a strange planet, leveling up until you find the exit to the surface.",
  "requirements": "",
  "screenshots": [],
  "trophies": false,
  "ai": false
}
