{
  "id": 1841,
  "name": "The Dark Flower",
  "author": "madsoul, rikardo_92",
  "category": "game",
  "platform": "psp",
  "icon": "1841-the-dark-flower.png",
  "description": "Super Mini Mario mod.",
  "requirements": "",
  "direct_url": "https://archive.org/download/tdf.-7z/TDF.zip",
  "version": "1.0",
  "screenshots": [],
  "trophies": false,
  "ai": false
}
