{
  "id": 1297,
  "name": "Pro Foosball",
  "author": "Madcupid",
  "category": "game",
  "platform": "psp",
  "icon": "1297-pro-foosball.png",
  "description": "Homebrew game for PSP.",
  "requirements": "",
  "direct_url": "https://archive.org/download/pro-foosball.-7z/PRO%20FOOSBALL.zip",
  "version": "1.0",
  "screenshots": [],
  "trophies": false,
  "ai": false
}
