{
  "id": 1813,
  "name": "Star Wars Rocks",
  "author": "Greg Tourville (XiGency), dragula96",
  "category": "game",
  "platform": "psp",
  "icon": "1813-star-wars-rocks.png",
  "description": "Homebrew game for PSP.",
  "requirements": "",
  "direct_url": "https://archive.org/download/swrocks102.7z/swrocks102.zip",
  "version": "1.0",
  "screenshots": [],
  "trophies": false,
  "ai": false
}
