{
  "id": 1090,
  "name": "Marijuana 'The Truth'",
  "author": "Mugenjohncel",
  "category": "game",
  "platform": "psp",
  "icon": "1090-marijuana-the-truth.png",
  "description": "Visual novel ported to PSP.",
  "requirements": "",
  "direct_url": "https://archive.org/download/nanoreno2012-marijuana.7z/nanoreno2012-marijuana.zip",
  "version": "1.0",
  "screenshots": [],
  "trophies": false,
  "ai": false
}
